{
  "schema_version":"0.1",
  "id":"py-default-none-guard-ownership",
  "language":"python",
  "locale":"en",
  "type":"equivalence",
  "level":"intermediate",
  "difficulty":0.57,
  "concepts":["py.default-arguments","py.functions","py.booleans","py.lists","py.assignment","py.mutation-aliasing"],
  "prompt":"An editor replaces if not bucket with if bucket is None. Each complete script starts fresh and explicitly passes the empty list existing. Compare the exact printed lines, including the identity result, and choose the correct explanation. Do not assume that an explicitly passed empty list is an omitted argument.",
  "snippets":[
    {"id":"truthiness","label":"Truthiness guard","code":"def collect(value, bucket=None):\n    if not bucket:\n        bucket = []\n    bucket.append(value)\n    return bucket\n\nexisting = []\nreturned = collect(7, existing)\nprint(existing, returned, returned is existing)\n","highlight_lines":[2,3,8,9]},
    {"id":"none-identity","label":"None identity guard","code":"def collect(value, bucket=None):\n    if bucket is None:\n        bucket = []\n    bucket.append(value)\n    return bucket\n\nexisting = []\nreturned = collect(7, existing)\nprint(existing, returned, returned is existing)\n","highlight_lines":[2,3,8,9]}
  ],
  "options":[
    {"id":"arguments-always-copied","text":"Both print [] [7] False. Passing a list to a parameter makes an independent copy, so neither script can mutate existing.","score":0,"feedback":"Binding a parameter does not copy the list. The truthiness guard replaces its empty bucket with a new list, but the None guard keeps the explicit empty list and appends to it. Their outputs differ.","misconception":"py.assignment-copies-value"},
    {"id":"empty-list-truthy","text":"Both print [7] [7] True. Even an empty list is truthy, so neither guard creates a replacement list.","score":0,"feedback":"An empty list is falsy. Thus if not bucket creates a replacement in the first script. The identity check is false for the explicit list in the second, which keeps and mutates that list.","misconception":"py.all-lists-truthy"},
    {"id":"guard-values-not-call-history","text":"Truthiness guard prints [] [7] False; None guard prints [7] [7] True. The first replaces the falsy list; the second checks the actual value None and preserves this explicit list.","score":1,"feedback":"Correct. Empty and omitted are different cases. The first guard rebinds bucket to a fresh list; the second leaves it referring to existing, so its append changes the caller's list.","misconception":null},
    {"id":"right-traces-omission-only-test","text":"Truthiness guard prints [] [7] False; None guard prints [7] [7] True. is None detects only omission: it could never be true if the caller explicitly supplied None.","score":0.5,"feedback":"Both complete lines are right, but is None tests an object's identity, not call history. Explicitly passing None would also make that check true. Here the supplied value is an empty list, not None.","misconception":"py.none-check-detects-omission","partial_reason":"Correct: both complete printed lines, caller mutation and returned-list identity. Incorrect: claims is None detects only an omitted argument and cannot match explicitly supplied None; it tests the bound value regardless of how it was supplied."},
    {"id":"append-returns-new-inner-result","text":"Truthiness guard prints [] [] False; None guard prints [] [] True. append creates a new list without changing its receiver, and that return value is ignored.","score":0,"feedback":"append mutates its receiver. In the first script that receiver is a fresh replacement; in the second it is existing itself. Ignoring append's return does not cancel either mutation.","misconception":"py.append-nonmutating"}
  ],
  "explanation":"The caller explicitly binds bucket to existing in both scripts. A default is not substituted for that explicit empty list. Since [] is falsy, the first guard rebinds bucket to a fresh list, leaving existing empty and returning a different list containing 7. The second guard is false because the list is not None; append therefore mutates existing and the returned reference is identical. An is None check also matches explicitly supplied None; it does not reveal whether the argument was omitted.",
  "verification":{
    "status":"specified",
    "cases":[
      {"id":"truthiness-explicit-empty","snippet_id":"truthiness","stdin":"","expected":{"stdout":"[] [7] False\n","exit_code":0}},
      {"id":"none-explicit-empty","snippet_id":"none-identity","stdin":"","expected":{"stdout":"[7] [7] True\n","exit_code":0}}
    ],
    "rationale":"Run both exact displayed scripts separately. Their literal outputs and identity booleans refute equivalence for this explicit-empty-list call. Whether is None can match explicitly supplied None is a separately reviewed semantic fact, not an undisplayed test claimed to have run.",
    "limitations":"Finite concrete comparison only, not a proof about arbitrary arguments. This tests sentinel control and caller ownership, not mutable-default reuse across calls. Execution does not establish the causal account, genuine half credit or learner calibration."
  },
  "author":{"name":"Code reading contributors"},
  "license":"CC-BY-SA-4.0"
}
