{
  "schema_version": "0.1",
  "id": "ui-fixture-independent-if",
  "language": "python",
  "locale": "en",
  "type": "output",
  "level": "beginner",
  "difficulty": 0.25,
  "concepts": ["py.conditionals", "py.assignment"],
  "prompt": "What does this program print, and why?",
  "snippets": [
    {
      "id": "main",
      "code": "score = 7\nif score > 5:\n    print(\"high\")\nif score > 3:\n    print(\"medium\")\nelse:\n    print(\"low\")\n",
      "highlight_lines": [2, 4]
    }
  ],
  "options": [
    {
      "id": "both",
      "text": "`high` and then `medium`: the two `if` statements are checked one after the other, and both conditions are true.",
      "score": 1,
      "feedback": "Correct. Each `if` is its own test. The `else` belongs only to the second `if`, so it would run only if `score > 3` were false.",
      "misconception": null
    },
    {
      "id": "right-output-wrong-reason",
      "text": "`high` and then `medium`: the second `if` is only reached because the first one was true.",
      "score": 0.5,
      "feedback": "The output is right, but the reason is not. The second `if` is always evaluated, whether or not the first one ran.",
      "misconception": "py.independent-if-is-elif",
      "partial_reason": "Right: both lines are printed. Missing: the second `if` does not depend on the first one; it is always checked."
    },
    {
      "id": "only-high",
      "text": "Only `high`: once one condition is true, the remaining checks are skipped.",
      "score": 0,
      "feedback": "That is how `if`/`elif`/`else` behaves. Here the second test starts with `if`, so it begins a new, independent chain.",
      "misconception": "py.independent-if-is-elif"
    },
    {
      "id": "only-medium",
      "text": "Only `medium`: when several conditions are true, the last one wins.",
      "score": 0,
      "feedback": "Nothing is replaced or overridden. Every true `if` runs its block, in order, so `high` is printed before `medium`.",
      "misconception": "py.independent-if-is-elif"
    },
    {
      "id": "error",
      "text": "It raises an error, because an `if` needs the value `True` or `False`, not a comparison.",
      "score": 0,
      "feedback": "A comparison such as `score > 5` produces `True` or `False`, and any expression like that can control an `if`.",
      "misconception": "py.truthiness-only-booleans"
    }
  ],
  "explanation": "`score` is 7. The first `if` is true, so `high` is printed. The second `if` starts a new test: 7 > 3 is true, so `medium` is printed and the `else` branch is skipped.",
  "verification": {
    "status": "specified",
    "cases": [
      { "id": "run", "snippet_id": "main", "stdin": "", "expected": { "stdout": "high\nmedium\n", "exit_code": 0 } }
    ],
    "rationale": "Running the snippet shows the printed lines. It does not prove which explanation is the right one; that needs human review."
  },
  "author": { "name": "Fixture" },
  "license": "CC-BY-SA-4.0"
}
